{"title":"El gato va a casa","source":{"voice_transcript":"El gato tiene que llegar a la casa, no puede tocar el agua"},
 "genre":"top-down","grid":{"w":16,"h":12,"tile":40},
 "player":{"id":"gato","label":"Gato","x":1,"y":1,"color":"#f90"},
 "goals":[{"id":"casa","label":"Casa","x":14,"y":10,"color":"#4c4"}],
 "hazards":[{"id":"rio","label":"Agua","x":6,"y":0,"w":2,"h":9,"effect":"lose","color":"#39f"}],
 "walls":[{"x":10,"y":4,"w":1,"h":8}],
 "win_condition":{"type":"reach_goal","target":"casa"}}
